{
  "$schema": "https://json-schema.org/draft/2020-12/schema",
  "title": "Kalamos mcq-basic v1",
  "type": "object",
  "additionalProperties": false,
  "required": ["schemaVersion", "templateId", "templateVersion", "title", "questions"],
  "properties": {
    "schemaVersion": { "const": 1 },
    "templateId": { "const": "mcq-basic" },
    "templateVersion": { "const": 1 },
    "title": { "type": "string", "maxLength": 120 },
    "questions": {
      "type": "array",
      "minItems": 1,
      "maxItems": 20,
      "items": {
        "type": "object",
        "additionalProperties": false,
        "required": ["prompt", "choices", "correctIndex", "explanation", "evidenceRefs"],
        "properties": {
          "prompt": { "type": "string", "maxLength": 600 },
          "choices": {
            "type": "array",
            "minItems": 4,
            "maxItems": 4,
            "items": { "type": "string", "maxLength": 240 }
          },
          "correctIndex": { "type": "integer", "minimum": 0, "maximum": 3 },
          "explanation": { "type": "string", "maxLength": 1200 },
          "evidenceRefs": {
            "type": "array",
            "minItems": 1,
            "maxItems": 6,
            "items": { "type": "string" }
          }
        }
      }
    }
  }
}
